{
  "$schema": "http://json-schema.org/draft-07/schema#",
  "definitions": {
    "DeliveryStatus": {
      "description": "Delivery state of one product deadline: was the latest delivery on time, and is the next one at risk.\n\nReported by `rocky product status` and, per pipeline, by the scheduler status. `on_time` and `late_by_seconds` are facts about the latest delivery. `at_risk` rests on [`DurationEstimateStatus`], and is `null` whenever the estimate is `unknown`.",
      "properties": {
        "at_risk": {
          "description": "True when the p90 duration is longer than the time left before `next_due_at`. `null` when the estimate is `unknown`: no verdict.",
          "type": [
            "boolean",
            "null"
          ]
        },
        "deliver_by": {
          "description": "The product's `deliver_by` cron expression.",
          "type": "string"
        },
        "estimate": {
          "allOf": [
            {
              "$ref": "#/definitions/DurationEstimateStatus"
            }
          ],
          "description": "The duration estimate `at_risk` rests on."
        },
        "last_delivered_at": {
          "description": "When the latest production delivery finished.",
          "format": "date-time",
          "type": [
            "string",
            "null"
          ]
        },
        "last_due_at": {
          "description": "The deadline the latest delivery served, when its run recorded one.",
          "format": "date-time",
          "type": [
            "string",
            "null"
          ]
        },
        "late_by_seconds": {
          "description": "How late the latest delivery was, in seconds; `0` when on time. `null` when no delivery recorded a deadline.",
          "format": "uint64",
          "minimum": 0.0,
          "type": [
            "integer",
            "null"
          ]
        },
        "next_due_at": {
          "description": "The deadline the next delivery must meet. A time in the past means the next delivery is already late.",
          "format": "date-time",
          "type": [
            "string",
            "null"
          ]
        },
        "on_time": {
          "description": "Whether the latest delivery met its deadline. `null` when no delivery recorded a deadline.",
          "type": [
            "boolean",
            "null"
          ]
        },
        "output_model": {
          "description": "The model the product delivers.",
          "type": "string"
        },
        "product": {
          "description": "The product whose deadline this is.",
          "type": "string"
        },
        "timezone": {
          "description": "The timezone `deliver_by` is read in.",
          "type": "string"
        }
      },
      "required": [
        "deliver_by",
        "estimate",
        "output_model",
        "product",
        "timezone"
      ],
      "type": "object"
    },
    "DurationEstimateStatus": {
      "description": "A p50/p90 duration estimate and the sample behind it.",
      "properties": {
        "basis": {
          "allOf": [
            {
              "$ref": "#/definitions/EstimateBasis"
            }
          ],
          "description": "What was timed: `model_delivery` (run start to the model's finish) or `pipeline_run` (run start to run finish)."
        },
        "growth": {
          "description": "True when the newest 5 runs were all slower than the p90 of the older ones, so `p90_ms` is the slowest of those 5.",
          "type": "boolean"
        },
        "n": {
          "description": "How many production runs the estimate read.",
          "format": "uint",
          "minimum": 0.0,
          "type": "integer"
        },
        "p50_ms": {
          "description": "Median duration in milliseconds, when `known`.",
          "format": "uint64",
          "minimum": 0.0,
          "type": [
            "integer",
            "null"
          ]
        },
        "p90_ms": {
          "description": "90th-percentile duration in milliseconds, when `known`.",
          "format": "uint64",
          "minimum": 0.0,
          "type": [
            "integer",
            "null"
          ]
        },
        "state": {
          "allOf": [
            {
              "$ref": "#/definitions/EstimateState"
            }
          ],
          "description": "`known` with at least 5 runs; `unknown` below that, and then no verdict rests on the estimate."
        },
        "window": {
          "description": "The most runs it reads (the newest 20).",
          "format": "uint",
          "minimum": 0.0,
          "type": "integer"
        }
      },
      "required": [
        "basis",
        "growth",
        "n",
        "state",
        "window"
      ],
      "type": "object"
    },
    "EstimateBasis": {
      "description": "What a duration estimate timed.",
      "oneOf": [
        {
          "description": "From run start to the product's output model finishing.",
          "enum": [
            "model_delivery"
          ],
          "type": "string"
        },
        {
          "description": "From run start to run finish, for the whole pipeline.",
          "enum": [
            "pipeline_run"
          ],
          "type": "string"
        }
      ]
    },
    "EstimateState": {
      "description": "Whether a duration estimate has enough runs to judge from.",
      "oneOf": [
        {
          "description": "At least 5 runs: the band is reported.",
          "enum": [
            "known"
          ],
          "type": "string"
        },
        {
          "description": "Fewer than 5 runs: no band, no verdict.",
          "enum": [
            "unknown"
          ],
          "type": "string"
        }
      ]
    },
    "ProductApprovalOutput": {
      "description": "The approval record, as echoed by compile/status output.",
      "properties": {
        "approved_at": {
          "description": "RFC3339 approval instant.",
          "type": [
            "string",
            "null"
          ]
        },
        "approver": {
          "description": "Best-effort approver identity.",
          "type": "string"
        },
        "snapshot_path": {
          "description": "Project-root-relative path of the immutable snapshot file.",
          "type": "string"
        },
        "spec_digest": {
          "description": "The approved `sha256:<hex>` spec digest.",
          "type": "string"
        }
      },
      "required": [
        "approver",
        "snapshot_path",
        "spec_digest"
      ],
      "type": "object"
    },
    "ProductSourceVolumeStatus": {
      "description": "One declared source range and the latest production count of its table.",
      "properties": {
        "counted_at": {
          "description": "When that run started.",
          "format": "date-time",
          "type": [
            "string",
            "null"
          ]
        },
        "max_rows": {
          "description": "The declared `max_rows` (inclusive), when set.",
          "format": "uint64",
          "minimum": 0.0,
          "type": [
            "integer",
            "null"
          ]
        },
        "min_rows": {
          "description": "The declared `min_rows` (inclusive), when set.",
          "format": "uint64",
          "minimum": 0.0,
          "type": [
            "integer",
            "null"
          ]
        },
        "row_count": {
          "description": "The table's total rows when the newest production run that counted this product's sources started. Absent when that run took no count of this table, or none has run yet.",
          "format": "uint64",
          "minimum": 0.0,
          "type": [
            "integer",
            "null"
          ]
        },
        "run_id": {
          "description": "The run that took the count.",
          "type": [
            "string",
            "null"
          ]
        },
        "severity": {
          "allOf": [
            {
              "$ref": "#/definitions/VolumeSeverity"
            }
          ],
          "description": "The declared severity: `warning` (the default) or `error`."
        },
        "table": {
          "description": "The source table, as the spec lists it.",
          "type": "string"
        },
        "verdict": {
          "allOf": [
            {
              "$ref": "#/definitions/VolumeVerdict"
            }
          ],
          "description": "That count judged against the range the spec declares now: `in_range`, `below_min`, `above_max`, or `not_evaluated` when no count exists."
        }
      },
      "required": [
        "severity",
        "table",
        "verdict"
      ],
      "type": "object"
    },
    "ProductVolumeStatus": {
      "description": "The declared volume range and the latest production count.",
      "properties": {
        "counted_at": {
          "description": "When that build finished.",
          "format": "date-time",
          "type": [
            "string",
            "null"
          ]
        },
        "max_rows": {
          "description": "The declared `max_rows` (inclusive), when set.",
          "format": "uint64",
          "minimum": 0.0,
          "type": [
            "integer",
            "null"
          ]
        },
        "min_rows": {
          "description": "The declared `min_rows` (inclusive), when set.",
          "format": "uint64",
          "minimum": 0.0,
          "type": [
            "integer",
            "null"
          ]
        },
        "row_count": {
          "description": "The newest production build that recorded a count. Absent when no build has been counted yet.",
          "format": "uint64",
          "minimum": 0.0,
          "type": [
            "integer",
            "null"
          ]
        },
        "run_id": {
          "description": "The run that took the count.",
          "type": [
            "string",
            "null"
          ]
        },
        "severity": {
          "allOf": [
            {
              "$ref": "#/definitions/VolumeSeverity"
            }
          ],
          "description": "The declared severity: `warning` (the default) or `error`."
        },
        "verdict": {
          "allOf": [
            {
              "$ref": "#/definitions/VolumeVerdict"
            }
          ],
          "description": "That count judged against the range the spec declares now: `in_range`, `below_min`, `above_max`, or `not_evaluated` when no count exists."
        }
      },
      "required": [
        "severity",
        "verdict"
      ],
      "type": "object"
    },
    "VolumeSeverity": {
      "description": "What an out-of-range row count does to the run.",
      "oneOf": [
        {
          "description": "The model is marked failed after its build, and the run is partial.",
          "enum": [
            "error"
          ],
          "type": "string"
        },
        {
          "description": "The run reports a warning, and delivery is recorded as usual.",
          "enum": [
            "warning"
          ],
          "type": "string"
        }
      ]
    },
    "VolumeVerdict": {
      "description": "The outcome of one volume check.",
      "oneOf": [
        {
          "description": "The count is inside the range.",
          "enum": [
            "in_range"
          ],
          "type": "string"
        },
        {
          "description": "The count is below `min_rows`.",
          "enum": [
            "below_min"
          ],
          "type": "string"
        },
        {
          "description": "The count is above `max_rows`.",
          "enum": [
            "above_max"
          ],
          "type": "string"
        },
        {
          "description": "No count was taken, or it could not be read. Never a failure for `[product.output.volume]`. For an `error` source range, a count that could not be taken refuses the output build; a cancelled run does not.",
          "enum": [
            "not_evaluated"
          ],
          "type": "string"
        }
      ]
    }
  },
  "description": "JSON output of `rocky product status`.",
  "properties": {
    "approval": {
      "anyOf": [
        {
          "$ref": "#/definitions/ProductApprovalOutput"
        },
        {
          "type": "null"
        }
      ],
      "description": "The approval record, when one exists."
    },
    "artifact_problems": {
      "default": [],
      "description": "Byte-verification problems against the committed manifest (empty = every committed artifact matches its recorded hash).",
      "items": {
        "type": "string"
      },
      "type": "array"
    },
    "command": {
      "type": "string"
    },
    "committed_phase": {
      "description": "The committed lowering phase, when a manifest exists.",
      "type": [
        "string",
        "null"
      ]
    },
    "committed_spec_digest": {
      "description": "The committed manifest's spec digest, when one exists.",
      "type": [
        "string",
        "null"
      ]
    },
    "delivery": {
      "anyOf": [
        {
          "$ref": "#/definitions/DeliveryStatus"
        },
        {
          "type": "null"
        }
      ],
      "description": "Delivery state, when the spec declares `deliver_by`: whether the latest production delivery was on time, how late, and whether the next delivery is at risk. The estimate times run start to the output model's finish."
    },
    "fulfill_state": {
      "description": "The persisted fulfillment state tag, when one exists.",
      "type": [
        "string",
        "null"
      ]
    },
    "journal_rows": {
      "description": "Number of fulfillment journal rows recorded for this product.",
      "format": "uint64",
      "minimum": 0.0,
      "type": "integer"
    },
    "output_model": {
      "description": "The resolved output model, when the spec parses.",
      "type": [
        "string",
        "null"
      ]
    },
    "product": {
      "description": "The product name the status was asked for.",
      "type": "string"
    },
    "product_id": {
      "description": "`product:<name>`, when the spec parses.",
      "type": [
        "string",
        "null"
      ]
    },
    "snapshot_intact": {
      "description": "Whether the approval snapshot's bytes still digest to the recorded value. `null` without an approval; `false` is tamper.",
      "type": [
        "boolean",
        "null"
      ]
    },
    "source_volumes": {
      "description": "Source range state, one row per `[[product.source.volume]]` the spec declares: the range and the count the newest production run that counted this product's sources took at its start. Empty (and omitted) when the spec declares no source range.",
      "items": {
        "$ref": "#/definitions/ProductSourceVolumeStatus"
      },
      "type": "array"
    },
    "spec_digest": {
      "description": "The working spec's digest, when it parses.",
      "type": [
        "string",
        "null"
      ]
    },
    "spec_error": {
      "description": "Why the spec failed to parse, when it did not.",
      "type": [
        "string",
        "null"
      ]
    },
    "spec_matches_approval": {
      "description": "Whether the working spec equals the approved revision. `null` when either side is missing.",
      "type": [
        "boolean",
        "null"
      ]
    },
    "spec_present": {
      "description": "Whether `products/<name>.toml` exists and parses.",
      "type": "boolean"
    },
    "staging_journal_present": {
      "description": "Whether an uncommitted staging journal is pending. Status never mutates; the next compile resolves it.",
      "type": "boolean"
    },
    "version": {
      "type": "string"
    },
    "volume": {
      "anyOf": [
        {
          "$ref": "#/definitions/ProductVolumeStatus"
        },
        {
          "type": "null"
        }
      ],
      "description": "Volume state, when the spec declares `[product.output.volume]`: the declared range and the latest production count judged against it."
    }
  },
  "required": [
    "command",
    "journal_rows",
    "product",
    "spec_present",
    "staging_journal_present",
    "version"
  ],
  "title": "ProductStatusOutput",
  "type": "object"
}
